y_text,y_emb
information presentations design principles,01011011111111111001110010001011011111101010
module product ingredients module,11001110011111110100100101101101111001110011
tasks avoiding loss delay,10110011001000111011101100000011100100111000
process piped input frequency,11111110110111100110000101100111101110111010
input device independence user,01011001111001000011010101111001010011110010
top providing links information,10010011110111110000010100001100101011011111
different mental models navigation,00100000111110001000111100111010111001000110
streams interrupted little possible,10111100110010010111000100000111011110111111
constraints proper user authentication,00111001100111110110001001111001000011110010
flexible enough accommodate evolving,01111101111011011111100000000101101101001000
program interface database choose,11111011101010010010000010110000100110010001
shown maintained indicating navigation,10101010001110000110000101101000011001000110
shall unrestricted access aspects,10101110100100111010110000000110100011001001
multiple cameras broadcast simultaneously,11001011011000100010110001011001010101011001
better execute greater efficiency,00010101110011010001010111000000101100100101
labels go click except,01000100101011100010100011011010001101001111
feature would give value,01111010100100011011100111000100010011001001
search multiple search criteria,10100111011110010110111010011101100101111111
peers using recent apple,11010001011100110111001110111111100001001101
content navigation user interface,00111000000110010001101001111001001001001000
want go website watch,10001001010011100010101000101010010001011001
initial entries made registration,01011011001011011100101100000111011100100011
deployment many environments correctn,00100110110110001100100110111000100101011011
content screen supported suitable,00111000000101001111001011011110010110101001
specialist software used appropriate,10111000100101010000111001111011100001000001
translatable text warning message,10010110000101100000011000100100011001100001
times application pages designed,10010001111000010001001101011011100100010101
control user access correspondences,00101000111100111100100000000110100101011101
presentation content items form,11111100110001110000000100110100001111100000
set date meeting participant,10101111111001001000011100010010011010010010
stock verification search facility,10111101000100110011001010011101101111001000
frequency shift parameters windowing,01110111010101011101101101011000010001110111
specification ppcast page broadcaster,10111001111111101011111101011010100010110011
optional frequency domain processing,11010100000011101110100110001011111111110001
items replaced smaller phone,01001101000111001110101010100011111110001111
whereabouts customizable system shall,10001010000001011011111011001000110101110100
looking title interested inthen,11000000110100100011100100100101101001010110
users administrators actions initiated,10011010111000011000010000011001001011001000
periodically upon request check,11110000000100111111101110001000000110010110
designing application pages general,00100010100000010001001101011011101110011100
research department information technology,11100011111001001101010101101111110110001101
segment position respect overall,10100100111111101101001110000111011010101001
book looking title interested,00010111001110000001101001000111001001001011
text recognize assumption none,10110000001111011110110001101110011011001011
face changing network conditions,01111001010001100111111101100011100111010001
change exclusion set monitor,00110011011011010001001010111111111001010000
output stream necessarily interconnects,11010101010101111001011100100001101001001110
observational mode correlator output,11011110000110011101000010101111111010101010
able select multiple cameras,00000000011101001000101100101101100010001011
normal system function failure,11011011111101100100010111011000001111011011
must able retrieve display,11001011000000000000111010000011001100001100
involving use back button,01001110110100111101010001110110000010011111
system transactions must designed,10110010001100100100101100101100000100010101
navigation components consistently navigation,11001000110001111111100011100101111001000110
need type product want,11001000000100101111101111101001010001001010
data queue memory buffer,00101100011111010011111100010001000010010111
needs providing different access,11011000001111110000010010000011100000001101
user access service broadcast,10011110010000000011011010111101100010110010
evident user individualization andor,01101011001100111100100101101001000001011111
support modules messagedata involved,10110111101110011100011100110001101001110010
disruptions begin streaming within,01100001110000101001001011110011110001111101
messages shall provide several,11001100010101011101001111100011010101111100
network conditions lowbandwidth connections,11011000111001110100011100000110000111011110
include need limited following,01011111010110010000000100001111101111100101
use ppcast mozilla firefox,10011110101111101011111100101110101111111011
around could give ideas,00011001111001010101010111000100001010101101
connection another peer begin,00111011111000010110101101000100100010100100
able make time stamp,00000000011110000111101001000110110111010110
types user interfaces include,10010111010100111100100100101100001011111010
function hpresentationrelated actions sorting,01110110000010101110100000011001010111000001
meeting date actual meeting,11000100100001001000010000011101011000100100
view broadcaster want go,10011000001000101100111000100101001110001010
control system tools user,00101000111101100100011001001101110011110010
via mc state count,10011000010110001110111011111011000101010111
provided prints content form,11111000010111111110000011100000001111100000
cases organised case user,00110000111110101001110011000011010011110010
rearrange meeting accommodate change,11101010000110001001000000000101100110011011
units based certain criteria,10011100111000101000000011000100100101111111
server computer desktop computer,10101101000001111101010010001110100111110101
server communication channel used,10101101000001111000010011001110110011110111
different categories using one,00100000111001100011011001101110011011101000
performance shall monitor overall,11010000110101011101001100101000011010101001
hosts isolated unix v,01010110101010011111101001110110010011011110
information maintaining files ie,01011011111110000110010111111000001010100001
made handle operations effectively,11000001110010100011101101110001101100101111
accommodate high number books,00000001011010100101101101101001100010111010
user interface rules small,10011110010010010010001010001110010101000101
search show product nameprize,10100111011101011100001111101001011001001010
well calls add remove,10001010111000100010000000010100111100101011
must able export audit,11001011000000000000110111100011100011110000
facts following investigation police,01111011000011111001010100111000011110110001
groups tasks information needs,01010000001101100110010101101111111011000001
outside application browser interface,11010101011000010001000001001001101001001000
person type crime modus,11110000111100101111100010111110011001110000
shall keep track data,10101110100010011001011001001110000101100011
providing user authentication validation,11111000001100111100100001111001010011011001
accessible users within application,00000001010100110101111000111110100001000100
begin streaming within seconds,00010100100101111001111000111110110100101011
want able stream whats,10001001010000000000111011110010110001010011
explicit dependencies meeting date,01111000010001001101111100010010000100100001
channel concept overlay ppcasts,00110011101001111100111101011100111110101101
goal give product ingredients,01110001110011100010001111101001001011011011
new browser windows popup,11011001100000100100111000111010111110110110
special needs compatible specialist,10111000101110110000010011110110110111000100
device independence user interfaces,00100001101010111100101001111001001001011000
ability remove user system,00000000001111001010111001111001010110010001
interfaces abstracted webrtc api,01001011000000000001101000101110000001001001
access searches case right,00000001101101001110010011000011010100001011
capabilities restrictions perceiving colour,00010001100111000000011101000010000110101111
limit access cases specified,01000011101000000011010011000011110111001010
input user fill search,01011001111100111100100111111000110100111011
basic knowledge computers internet,00010100011010001000110011111011101001011101
try tcp http later,10010110101101100010000101011100101000111000
regardless storage capacity number,11101100000101111010100001000011111011010011
maintain system must sufficient,11000001001101100100011100101100010110101011
customize results view criminalaccused,00101101101101000000001001100000100101111101
recommended products module product,11101111000111110101111100111001111111010010
delete item click button,00100111001010011110000011011010000010011111
avoid possible problems example,00011101011111101111111111111010001101001010
abstracts webcam andor microphone,00000000111100010111010000101111111001101101
hardware failure operating system,01010011000011110110111101110011110110010001
automatically capturing storing information,00011111010000100000001011110110101011011111
entities output data management,01101110111110101010100010110001111000010010
provided surety account secure,11111000010101101101100000001101010100101111
predefined user profiles userspecified,11110100111100111100101111101110010011010101
product navigation product recommended,11111010010110010001101111101001011101111000
police initiates investigation process,11110110001010110010010100111000011111110110
standard header including housingu,10111010010010100110010101111110101010111111
used appropriate interface guidelines,10011110111000010000010100100100001010000101
profile currently used made,11111010100001011010001001111011111000001110
identifier uc description searching,01010100101100101110000010001000110100101000
session hijacking important address,10101111010010100100110101110100100000100100
important provide users information,01011101001111110001101001101011101011011111
labels commonly understood semantics,01000100101001101000011001010001110101100111
software interfaces product run,10101000011010010110001111101001010100010100
chat broadcasters viewers software,00110010111000101100011000100000010101000011
models navigation strategies tasks,11001110101110010001101011110110010110011001
partial data zero data,11010010011001011000111000110011100101100011
messages exchanged participants easy,11001100010011010011001101001011001100111001
reached varying etc accuracythe,11101011111100110011010110101010000000010100
interface module cctns acts,01001001000110011100110011000101100000111110
supported according policies stated,10110111100000000110011111011001110111110111
set system access properties,10101111111101100100010000000110111111001001
police cut short drudgery,11110110001001011001001010111001101100110011
enough accommodate evolving data,01101111110000000010110110100100000101100011
navigation recommended products module,11001000110111011110001111101011111001110011
member id proper monitoring,11000100111010101010101111101100011001010011
traffic originates mobile device,10010010101110101011011100111110100100001101
quality textual content respect,11101000111100100000010011100000011100001110
sets output data queue,10101111101110101010100010110001111101001111
edge easing day day,01100111000011001110110010010011000100100110
page mockup homepage ppcast,11010110101110011111000101011000111110101111
standard post get methods,10111010010111101110100111001100111001100100
change preference set conflict,00110011011111101000001010111111100111010101
shall consulted screen text,10101110100001110001111010011110010110000001
barcode show price product,00011100000101011100001111110111111111010010
form suitably formatted output,01111100000101101010000111010001111010101010
direct manipulation iso forms,00100000001110000100010100111111101110100111
user authentication validation members,10011110010000111100101001101100111000100110
use case diagram budget,10011110101001100001100010000010000010010110
added later channel list,00000101011010001110000011001110101000011000
differently varying user groups,00100000110100110011011001111001001010000001
download times application pages,01100010010100100011110000100010011010110111
identifier uc description set,01010100101100101110000010001000110101111111
halal recognition screen essys,01010001100111011110101010011110001101010101
regardless storage capacity number,11101100000101111010100001000011111011010011
lag frames less values,01000100100011101010110100011000010011001011
delay hardware accessibility system,00100111000010100110000000000111010110010001
supported suitable means including,10110111100101101010011100010100001011111101
screens avoided unless provide,10100111101000111010101001110110111111000110
added preference set date,00000101011111101000001010111111100100100001
parameter changes external inputs,11010110001001100111100111100111101011001101
principles human perception designing,11111101010010101010001101000010100100010100
lag sets data integrity,01000100100101011111010010110001101001000001
online reading printerfriendly version,11011101001111010101101111110100010011000101
sent data successfully received,10101101111001011000111011010111011101111100
guide install maintain system,01010000111010110001011100000100110110010001
user system administrator shall,10011110010101100100010000110000010101110100
one branch still stored,11011101000000101101111011111100110111101111
designed help users understand,00100010101010100110101001101011110010100110
requests categorywise statuswise age,11100010011001100011101011111101000001101010
distinguishable links lead different,01100001000010000110010100011111000100000111
concept overlay ppcasts peertopeer,00111110011110101110011111010110111010001010
automatically different peer connection,00011111010001000001111101000100100111011111
information actions createreadupdatedelete taken,01011011111000001100100010111010110110011101
processing correlator lag values,11111110001001010111110100010010010011001011
textual content respect spelling,10010000001001110000001110000111010111011011
meeting proposed meeting cancelled,11000100100111110011101100010010000010001111
pages help navigating cctns,11010110111010100110101100100011100110001011
samplesdumps integrated spectral channel,10100010011010110000001011100100000110011101
similar product user want,10101011101111110100101001111001010001001010
module use case diagram,11001110011100111101010011000011000100000100
right create changes system,10100001011001011101100011001111010110010001
quantization correction shall able,11101000101001010010001010111010000000000011
remove select data database,11100101011101001000100010110001100101100001
following changes menu contents,01111100101001100111101100010000000101000000
cross referencing entered addresses,00101111010111011000100110111110000000100101
communication originates human thus,00111100001110101011010101010100010010001100
shall violate archive data,10101110100100010000110001100011000101100011
html forms links w,01010111011011101001110100001100110001001111
system critical increased useracceptance,10110010001001011111100101111011110011110011
case user chronological sequence,00110000110100111100100011011000110101101010
failure operating system hangs,01111011011110111001111011001000101010001001
morally broadcasters shall know,11001010101000101100011010111010001000100001
back end ajax used,00011101100011011010000000111101110011110111
right access system must,10100001011000000011011011001000111001011000
internet connection user latest,01001011101001110111111001111001001000111001
offered support different navigation,11011111100101101111010010000011111001000110
database get crashed certain,00101100001011100110010010111001100110001001
registers first time data,11100100001011111110011001000110100101100011
management system shall handle,11000010010101100100011010111010001010001110
adapting content profile currently,00000101000001110000001111101010000101101000
searching screen essys interface,10100101000101001111000110101010101001001000
must made customizable userconfigurable,11001011000110000011100010110111110011110001
affect data processing pipeline,00001101101001011000111111111000111110011001
listing watch list edited,01000001001100010110010100001100001100101001
account human capabilities restrictions,00000011010010101010000001000110011100000001
allows users make unauthorised,00001110010100110101111100001111010010101110
user able request meeting,10011110010000000000111110001000011000100100
customer track budget actor,00101101001100100111000001001011000000111111
meeting done dynamically much,11000100100011000101100110011111111001011111
perform windowing operations prior,11010000111100011101111101110001111111111001
errors shall trap flag,01101010010101011101001001011001101111101001
system shall able sit,10110010001101011101000000000001110101001000
time output system shall,10010001101110101010101011001000110101110100
application showing structure site,00001000100101010100001011010000010101001001
user access constraints proper,10011110010000000011010011100110011111011000
constraints expressed meeting participants,00111001100011110001011100010010011010010110
administrator shall ability create,00001100000101011101000000000000100101110110
count data produced correlator,00101010111001011000111111101001100101011111
processing parameters names positions,11111110001110101100001100100111011110111100
acceptable opening times download,00000000100110111011111001000111101100010010
warning report warning number,10001001000111001101111000100100011011010011
data form suitably formatted,00101100011011111000001011010100001110100011
ppcast using webrtc api,11110101111100110111001000101110000001001001
request replies awareness planning,11100010000111001101000001110110111110010111
ability librarian addedit delete,00000000001010000100100000010101000100111001
must features would preclude,11001011000011110101011000110111011110100101
admins creating project right,00001100011001011101001111101101110100001011
withinpage links withinpage links,10001111111010000110011000111111101000011001
automatically system result system,00011111010101100100011110000000010110010001
well effort needed recover,10001010111011001001101101100000011101101111
cctns provides role based,00110001011111110000111010001100100010100000
internally externally generated data,01001011010011110011100111001111000101100011
information technology template user,01011011111101100011011011000010010011110010
data execution data using,00101100011011010001110010110001110011011100
ee internal data shall,01100101010010010110110010110001110101110100
constable police station constantly,00111001010111101100011011111110000111001110
virus operating system failure,10001000110110111001111011001000101111011011
data obtained standby mode,00101100011110111100101011101000011001110100
ability block access system,00000000001000101010010000000110110110010001
prevent user session hijacking,11111101100100111100101010111101001010010011
bulleted lists highlighted keywords,00010011100010000010100101001001001001100001
must ensure audit trail,11001011000011011111110001111000010010010111
system administrator shall unrestricted,10110010001000011000001010111010010011101011
spectra including invalid data,10111001001010111111010100101000100101100011
data made accessible achieved,00101100011110000011100000000101000000010110
regardless storage capacity number,11101100000101111010100001000011111011010011
using functions provided user,10011011100011100101111111100001010011110010
records various functionalities provided,11101101110100110011110111001000111111000010
make communication reliable communicate,11000011110001111000011110010110100110100000
calls add remove select,00010001000000001010011110010101110100100010
operating system software interfaces,11011100111101100100011010100001101001011000
repo compiles code hosts,11100110101001111011110011011100101010110101
stations varying numbers cases,10111111101100110011011101101000100110000111
action remedy lessen impact,00000110011111001011100100001000001011100010
underflows overflows computation errors,10010100101110101110000011111110101101010010
time domain processes yet,10010001101011000101111111111001110001100101
based role system included,00010100000101000110011011001000101011111110
users able see modify,10011010111000000000111010010010111001110010
system result system parameters,10110010001111000000001011001000111010110000
style reading understanding textual,10110100111111010101101001010001010010000001
today website traffic originates,10010001011100010101001001001010111010101101
email addresses personallyidentifiable information,01101100001000001001011111000010001011011111
tools ui bootstrap websockets,10010011011100101010010001011111110001010101
terminology navigation links navigation,10110000111110010001100100001100111001000110
delete hisher questions answers,00100111001010100100011110100110100001011011
added participants preferences set,00000101011110100101101111110000010101111111
measurement currency designing user,11000101001001011110010010001010010011110010
memory buffer lag frames,11000100010000100101110100010010001110101011
shall periodically upon request,10101110100111100000001001111111011100010000
tasks avoiding loss delay,10110011001000111011101100000011100100111000
familiar common look feel,01111011110001101000111100000001001111010110
iso shall standard guidance,01001111111101011101001011101001001010000110
recognize halal logo goal,11101111011010100011000100000000001110001110
attributed component system workstation,00011010001001111110101011001000110001101011
create log messages exchanged,00101110110010000001111100110001001101001100
product know status check,11111010010010001000011011111111000110010110
observational mode shall receive,11011110000110011101001010111010011101110100
inline synchronization within hours,01011001110101101100001000111110101010110100
wish examine analyse system,10001111100011010010110000101110010110010001
allow persistent defaults data,00001110101111100001100010010110000101100011
traffic different times areas,10010010101001000001111001000111100011000100
spectra meta auxiliary data,10111001001110011001100001111100100101100011
search result list record,10100111011111000000000100001100011101101011
stream effectively little technical,10111100101011001011110100000111010110001011
recovery forgot password data,11101101100011111000011101001111000101100011
checking receive errors determining,00110010010111011101000110101001000100001010
user wanted increase rease,10011110010100010010110101111010111101110000
nonfunctioning components start process,11011011001001111111101011111000111111110110
specify qualitative attributes userfriendliness,10111001011111010001100001101000010011010000
product navigation recommended access,11111010010110010001101110111100000000001101
system able handle explicit,10110010001000000000110101000111001111000010
able rectify small problems,00000000011111011001001010100010111111110100
semantics particular application domain,10101100111110100101110000100010001100010111
sequence andor parameter changes,10101101010000010111111101011000100110011110
access mobile application name,00000001101110011111010000100010011001001011
general footer includes important,01110011100011111000110101111111101011101001
combination numbers processors individual,00110100100110110100011111101000001011010011
monitoring users behaviour adapting,11001010011100110101110001010110100000101000
channel used support modules,00110011101100111101111011011110111001110001
saving information maintaining files,10100110001010110111111100001100101111110000
arate navigation overview site,00011000001110010001101101011101010101001001
part system verify receive,11010010001101100100011001100010011101110100
pages important user navigation,11010110111010111010011001111001011001000110
printable document versions document,11111101011011000111011001100011101100011101
reports actions cases organised,11100110011000001100100011000011111010100111
aspects system user shall,00011001001101100100011001111001010101110100
human capabilities restrictions perceiving,01010101000000100011001110000000111010000100
actions user take response,00000110010100111100101011001110011100001100
performing search means returning,11010000011101001110111100010100010100000100
image limit postings human,01011100000010000111011111010100001010101000
shown conction associated content,10101010001001111100000001101111000111000000
assure communication connections intact,00011010100001111000010011101111001011000011
elements page distance blocks,01100100000110101101010110000101000010111000
presenting relevant information without,11111100100111001001000101101111110001111010
within seconds regardless storage,10001111101101001010111110110000010111101010
provided equivalent alternative textonly,11111000010011010100000000101000110010000000
software used appropriate interface,10101000011100111101110000100000101001001000
link labels target purpose,01000011010010001001011011001101011101000011
layout schemes supporting user,01000111011101001101011011011010010011110010
components overviews shown conction,00111111110110101111101010101000100111110000
must allow user member,11001011000000011101011001111001011000100111
hides many network media,01010010101110001100101101100011111000101110
details included use case,00100011001010111111101001111010100110000110
pids assure started tasks,11110001011000110101001011111001110110011001
interaction techniques found iso,01001000101101100011100111010110101001111111
