y_text,y_emb
physical processors assure needed,11110001010111110100000001101010011011000000
defined design simple different,00100101010001000101101010101111100100000111
able retrieve display within,00000000011101000001100110000110010001111101
get product details included,01110011001111110100100010001100101011111110
fit graphical user interface,01111111000011100000111001111001001001001000
measurement temperatures date time,11000101001101100011000010010000110010001101
interface tools housingu utilize,01001001000100100110110101011111110011011111
run variety operating systems,10100010100100110011101101110011110110010010
acts interface police citizens,00000111110010010010001111011000100110110110
obtained input arising processing,11011110010010110011110001100110111111110001
following protection user accounts,01111100101111110001001001111001000000011111
io performance shall monitor,01001110111110100001101010111010011001010000
perceiving colour means conveying,11010000100001101011111100010100000101001111
directly indicated label avoiding,00100000000010111100000100010011000011101110
screen essys interface user,10100111100011010101010100100100010011110010
must allow changes security,11001011000000011101010011001111010100100100
cases specified users user,00110000111101110010101001101011110011110010
result status report internal,11100000000101111111101110011011101001011011
also use system effectively,00001110001100111101011011001000101100101111
channel toolslibraries messagedata application,00110011101100100110101100110001100001000100
titles placed consistent location,10010001010111100110100011100100101000000100
price comparisons many different,11111101111001111001001100011001000100000111
prior experience application domain,11111111001011110000010000100010001100010111
searches case right access,10100111001001100001101010000101100000001101
stamp warning report warning,10111010110100010010001110011011110001001000
business rule anything captures,00010011101101000111010000101100000010000001
supporting user finding similar,10110110100100111100100111111110010101011101
specification increased time cpu,10111001111010111101111001000110100101110001
rapid skimming page impeded,11101001000101010011011101011010101011100101
processes networks failure number,11111110011110110001010111101101111011010011
produced system must meaningful,11111010011101100100011100101100011000111000
searching whichever location choose,10100101000100011100110100000010000110010001
among made via https,00001010111110000011101001100001001010111000
landk page easy recognize,01000101101110101101010110011100111101111011
potential use case view,11110101001100111101010011000011010011000001
handled gracefully minimize stream,01010001010011100001011100111100010111100101
unavailable critical data obtained,10010101101001011111100010110001111011110010
productivity helping citizens police,11111010110010100111110011011011011110110001
correctly ordered contains valid,00101011001110101001100011100000110011011011
check resolution policies participant,00110010110111000110001111011001111010010010
page viewers side automatic,11010110101100010000001010101010100011111110
halal nonhalal goal give,01010001100110110110110111000111001110001000
officers operating cutting edge,11011111010110111001110010110010101100111000
browser windows popup windows,00010010011100011101011111011011010001110101
addremove users add edit,00000101100100110101110000010100101100101000
laptops mobile devices abstracted,01000101010110011111010010000110000000000110
system processing interconnect hardware,10110010001111111100010100100111101010011000
maintained way user friendly,11000011000100010110111001111001001110110100
part firebase authentication access,11010010001011111110100001111001000000001101
shall able handle rebroadcasting,10101110100000000000110101000111011101110111
location planning meeting cancel,01000000100111100101111100010010000010001110
terms familiar user based,10110000110011110111101001111001000010100000
always connection another peer,00001010110001110111110000101101011010001001
encounters issues potential use,01101101010010011110011111010100110011110101
sufficient indication navigation structure,10110101011010110100011100100011010110100000
perform fourier transform showsup,11010000111011101011111001001000010101010010
recent apple macbook pros,11101111111000010011011100000111111111001111
long periods time throttle,11000000001111100000011001000110110010000101
standard used guidance content,10111010010100111101110101000011000111000000
system fast accurate library,10110010001011110111010000001010101000010111
user access system applicable,10011110010000000011011011001000100001001100
due virus operating system,01100110111100010001101101110011110110010001
channels without constraining bandwidth,00110011100100011110100011100111100011100010
processes applied coordinates etc,11111110011000010001110010100101001101010100
queue memory buffer lag,11101001111110001000100001001011101000100100
consistently pages framesets pages,00111001011110101101110111010100111010110111
formatted final results ee,01110100011011111101111010000000001100101010
user errors potential user,10011110010011010100101111010100110011110010
assumption none frequency medium,00011011100110110010110111011101011000101101
make unauthorised attempts access,11000011110100101011100001101001000000001101
etc monitoring users behaviour,01101010100110010100111001101011100010101101
within seconds advanced search,10001111101101001010110000110010110100111011
one second generate minimization,11011101000101001010010111001111111001101000
output stream necessarily interconnects,11010101010101111001011100100001101001001110
customizable userconfigurable extent possibleg,00101101111100111100010111100110111110111110
apple macbook pros baseline,00001001101110000011111111100111100010100001
times expected range technical,10010001111011110000001110100100110110001011
text presented pages readable,10110000001111111001011101011011111101010101
processor reboot network shall,11111110000111011100101101100011110101110100
place manner data needed,11110011011110000100000010110001111011000000
data operations hardware communicate,00101100011110111000110101001100000110100000
links lead different page,01000011001010001111100010000011111010110101
enhancement requests categorywise statuswise,01101111010111000100110011000111010111111010
communication connections intact functioning,00111100001001110111100101100001101110010110
temporary password plaintext prevent,10110000101110100111101111001110011111101100
important making content easy,01011101001110000111010011100000001100111001
seconds case accessed within,10100101011001100001100000000111110001111101
complete requested operations cached,00111101001111000100011101110001100010011001
requested operations cached data,11100010001110111000110001001100100101100011
alerts pending tasks etc,00001111110110100011101011001100101101010100
one important features potential,11011101000010111010010111101010111110101001
uc product navigation product,10010111000111110100101100100011011111010010
peer network lower quality,11010001001110110001111100000110111101000111
error statistics compare tolerances,01101010011101111111110011110011010010011000
sentences division text shorter,10101101110011000111111011000000110101110001
cctns application focused providing,00110001011000010001000111110110111111000001
provides ability librarian addedit,11111000011000000000010100001001000000101010
robust security mechanism place,10100001000101001001001100010101111110011011
used guidance content accessibility,10011110111010100001100011100000000000001110
links fields buttons important,01000011001011110100110001001111001011101001
ways prevent loss information,10001011010111111011001100000011101011011111
time response operation good,10010001101111000011001101110011001110001100
delay input output dat,00100111000010110011111101010101000101100010
process processor network functional,11111110110111111100001101100011101110010000
activated system must track,00000110110101100100011100101100010010011100
user take resolve error,10011110010101100111001110000100001101010011
meeting cancel meeting external,11000100100000100011101100010010001111001111
access system users selectively,00000001101101100100011001101011110101100000
referencing entered addresses google,11101100010011011111000000010010101110000100
memory buffer backup disk,11000100010000100101110001110011101100000101
designed mind reusable core,00100010101110011010111010000110100101001001
fully take advantage service,01110110001101100111000000110010010101111011
allows privileges granted peruser,00001110010111111111010111000001011110001101
user interface makes easy,10011110010010010010001100001111101100111001
suitable online reading printerfriendly,10110101001110111010011110101011011111101000
rebroadcasting least peers using,11101110111010001111001101000101110011011100
post condition customer get,11110111010001110100000010110100101110011001
actions taken users administrators,00000110010101100111011001101011100001100001
filled background color used,01111110011000111001010011010101010011110111
including replica self repeatable,01011111101111001111011010110000111100111001
sensitive data stored database,10101101101001011000111011110111100101100001
price product deduct amount,11111101111111110100100010010010000001010101
system srs metadata internally,10110010001101110111001100110011101001011010
file reference user identifier,01111010000111011001101001111001001010100101
policies participant interactions make,11110110011110100100100100100010011000011110
due disk crashes power,01100110111011000001010010111001011110101010
tasks reboot processor shall,10110011001111011100101111111000010101110100
user groups roles ie,10011110010010100000011010001101001010100001
processing flags table flags,11111110001011111010101011001011001111101010
system software interfaces webrtc,10110010001101010000110100101100010001011100
server support api application,10101101000101101111010000100100100001000100
mode needed processing correlator,11001110100110110000001111111000100101011111
json scheme json string,01001101100101001101110100110110010111100001
customers find position product,00101101011011111101001111011010011111010010
stream whats coming webcam,10111100101100010100110011010011010001011101
access mobile app name,00000001101110011111010000100101111001001011
name budget tracker identifier,11001001011000100101101001001010001010100101
useful allowing price comparisons,10011110110000011101101111110111100111100100
requirements safety use broadcast,11100010101101000100101001111010100010110010
access paths navigation structures,00000001101110100110011100100011010110100001
response times commonly performed,11100001100100100011110011010000111010000010
hardware used within system,01010011000100111101111000111110110110010001
examine analyse system activity,01101001011000010111001011001000100000111101
minimum able provide reports,11001111010000000000111111100011011100110011
count shall keep track,00101010111101011101000100110010110010011100
processing task backend processor,11111110001101100110110001110010011111110000
making content easy understand,11000011101001110000000110011100110010100110
customer assumption applicable frequency,00101101001000110111000000100110001110111010
inferred behaviour observed recommending,01011011100000101011011101111000111101101000
cases used infrequently stored,00110000111100111101110101101111010111101111
select channel name begin,10100100010001100111011100100101100010100100
taken avoid possible problems,10110011101000111010111111011111111111110100
priority shall able alter,11111111010101011101000000000001100001110000
content containing newer technologies,00111000000001110000111101100110110110001111
shall provide several optionally,10101110100111110001101010111110011010100001
interchange using json string,01001001101100110111000100110110010111100001
equipped using camera facility,01101110000100110111000001000100101111001000
issues order prevent breach,01001111001110101000101111110110000010110110
email window starting chat,01101100001100011101101011111001000110010111
computational error rates maximum,00111111100011010100111110101100111000111110
domain process piped input,01100010111111111101101111001100001011001111
delivery ee operational status,00100111111011001010101101110001010111111110
store formatted output data,10111101110011101000111101010101000101100011
using responsive css design,10011011100111000001110010111101100100010110
different content elements page,00100000111001110000000110010000011010110101
branch still stored server,00010110111101111110011011110111110101101000
able easily download install,00000000011011001110100110001001001011000101
different interfaces follow standard,00100000111010010110000111110010010111010010
page contain link leading,11010110101001110000100100001101001000111111
srs metadata internally externally,10111011100110011001110100101101001111001110
develop used chief performance,00100001110100111101110011001001111010000110
length page selected support,01000110011110101101011010010000110110111101
back button bookking pages,00011101100000100111110001011101111010110111
downtime system must exceed,01100010001101100100011100101100001101001110
iso shall standard guidance,01001111111101011101001011101001001010000110
big data execution data,00010101011001011000110110100011100101100011
updating account status showing,10011111011000000110101011111111010101010000
nameprize state halal non,11001001010101111101100101000110011011001010
webrtc javascript framework tools,10001011100010011010100111010100010010011011
links withinpage links clearly,01000011001100011111110100001100100110110101
make ision infer new,11000011110010011111000101101010011011001100
inspection request specific event,01011000100111000100001011100110001101011111
participants every constraint expressed,11010010110011010110100011100110101111000101
within system standard hardware,10001111101101100100011011101001001010011000
change destination ip addresses,00110011011001000111100100111010100000100101
json string plain text,01001101100101111000011111001110110110000001
structure site overview form,10110100000101010010011101011101001111100000
sets expected entities output,10101111101011110000000110111011111010101010
interfaces meet requirements recommendations,01001011000110001011001110001010111101111001
internal communications failures external,01001011011001111000110111101101001111001111
cannot changes project open,00010001101001100111101111101101111011101010
andor frames turned possible,00001011111011101010111001011110111110111111
listing watch list deleted,01000001001100010110010100001100000100111011
control panel allow librarian,00101000111110101101100000111010101000010010
unconverted input always recoverable,10010100100010110011110000101011011101101101
initiated automatically system result,01011001000000111110101011001000111100000000
warning shall provide error,10001001000101011101001111100011001101010011
effectively little technical knowledge,01100101111010000011101011000101101000100011
firebase json string desktop,01111111010010011011001011110000100100011101
changes security attributes groups,00110011110101001001000001101000001010000001
feature uc product navigation,01111010100100101110001111101001011001000110
post get methods multipart,11110111010011100110011100110010011001011010
equivalent alternative textonly page,01101010000000010100011001000000011010110101
skimming fast skimming text,10101001101011110111011010100110110110000001
access web browser name,00000001101100010111110001001001111001001011
hardware failure must possible,01010011000011110110111100101100011110111111
presentation frames used alternative,11111100110011101010111001111011100001010001
prior subsequent fourier transform,11111111001101101011000111010111110010010000
popup windows clearly ked,11110110110100011101010011011010101001100100
lower quality connections attempted,11000001101111010001110011101111000011010110
king corrupted data segments,01000100000001010111000010110001110100100110
capability system shall combination,00010000100101100100011010111010000110100100
among dates preference sets,00001010111001001000101111010000010101111101
desktop apache http secure,00100011101000010010000101011100110100101111
help material possible actions,01010011010110001111001111011111100000110010
rebroadcasting reusability webrtc api,11101110111101000011001000101110000001001001
used way impair visual,10011110111100010110110101110011010001000100
stable modern internet connection,10111010101110011101110100101110100111011111
see manage member accounts,10100100101110000101011100010011100000011111
ice framework connecting two,01010101001011101010000011101110110010111111
proximity feature allow users,11101000000011110101000000111010110011010111
etc accuracythe meetings monitored,01101010100000000101001100010010111001010001
module part interface mus,11001110011110100100010100100100011001011001
series assembly shall assemble,10101101001000110110001010111010000011001000
specified cases without affecting,10111001010001100001111000111101000001101111
media studies research department,11000101110101101000101110001111100100110101
see different traffic patterns,10100100101001000001111001001010111010011000
backend processor stop process,00011100100111111100001011110100111111110110
pillai institute information technology,11110001000010110000100101101111110110001101
potentially recorded viewer security,11110101011111011010101001100000010100100100
task create update viewing,10110011011001011101101001111100010001000001
configured according states requirements,00111010111000000110011011111010011100010101
framework first try connect,01110101000011111110011001011010100111011100
action types user interfaces,00000110011100101110101001111001001001011000
text resizable user text,10110000001111000110101001111001010110000001
connection user latest version,00111011111100111100100100011100110011000101
communicate users channel realtime,00110100000100110101110011001110111101010001
number navigation steps needed,11011010011110010001101011111101111011000000
button opposed horizontal list,00010011111110111000010101011011101000011000
receive incoming data packets,11101110100010111111000010110001111010110100
meetings monitored accurately especially,11000100101110010100010000001011101101010110
strategies tasks user taken,10111101100101100110011001111001010110011101
passwords administrators protected privacy,11010011010000011000011111100110011111111110
page lengths length page,11010110101010001100010100011001111010110101
items form bullet points,01001101000011111000000001001010011110110000
media objects nontext media,11000101110110110100001101101111011000101110
presentation segment page window,11111100110101001001111101011010110001110110
familiar user based hisher,01111011110100111100100001010000001010010001
system shall notify mc,10110010001101011101001101101001011000111011
processor backend tofrom monitor,11111110000000111001001001000100111001010000
report error number translatable,11100110111011010100111101101001110010110000
attributes multiple admins creating,00011010000110010110110000110001100101110100
upon request check backend,10011111110111000100000011001011000011100100
spelling gram sufficient impede,10111011011011100001111011010101101011100111
desktop computer client mobile,00100011101001111101010011011110011001111101
full content switch larger,01110110011001110000001011011000101000101001
proper user authentication provided,11111011000100111100100001111001011111000010
output time domain processes,11010101010100100011010110001011111111110011
condition none including use,00111010000110110010110101111110110011110101
invalid usernamepassword system able,01001010001100110101101011001000100000000011
constraints replanning meeting application,00111001100111001111111100010010000001000100
dynamic range across processing,01100111101111010010010000001000011111110001
select channel see stream,10100100010001100111011010010010110111100101
addresses correlator network general,00000100101001010111111101100011101110011100
css bootstrap jqueryajax html,00101111011000101111110100110111101010111011
process support negotiation conflict,11111110110101101111011101100001000111010101
testing maintenance operations personnel,10110000011110000110101101110001111110001100
maintenance personnel hand require,11000011010111100011000101000111111100010010
register browse list channels,11100100000000100100010100001100000110011100
none condition customer need,11011001011001110100000010110100111001000000
tools user access administrator,10010011011100111100100000000110100001100000
parameters word unalterable mean,11010110000100011110011001010101011000111001
users access rights security,10011010111000000011011010000100110100100100
functions standard peak conditions,01110010111101110100101101000100000111010001
highlighted keywords logical headings,01010010010010011000010100000001101010011011
expected form compatible aips,01111000000011111000000011110110100001111001
via ldap service also,10011000010010001110101010111101100001110001
amount previous number interface,00001010101111111011011101101001101001001000
structure current segment position,10110100000001011110001010010011111110110100
shall set system access,10101110100101011111111011001000100000001101
cpu total processor capability,00101110001100100111111111111000000010000100
used care taken avoid,10011110111001100000001011001110100011101011
page include standard header,11010110101010111110101011101001001010011001
goal give halal information,01110001110011100010000101000110001011011111
able hack users password,00000000011010100001001001101011111010011110
data stored due previous,00101100011101111011110110011011111111101101
useful content feedback application,10011110110001110000000111101011100001000100
librarian addremove users add,01000010010000001011001001101011100000101001
failures catastrophes maintain system,01111011010001100001001100000100110110010001
peers encrypted dtlssrtp defined,11010001011011011010110110011011000100101010
interfaces hardware used within,01001011000010100110001001111011110001111101
postal codes designed usable,11110111011001101110000010001010110011110100
invalid data zero values,01001010001001011000111000110011110011001011
domain processes yet proposed,01100010111111111100111000110010111111001110
display within seconds case,01100001100100011111011010010101100110000110
product advise customer item,11111010010000011011000010110100101001111000
users system access properties,10011010111101100100010000000110111111001001
dynamically much flexibility possible,01100111111110010111110111110111011110111111
users database user able,10011010111001011000011001111001000000000011
evidence facts following investigation,01101011011011110110000111110010101001110000
place unauthorized users allowed,11110011011100101011111001101011100001110111
mobile users users disabilities,11001111101100110101111001101011101100000000
personnel search particular person,11110001100101001110111101001011111110000111
accurate library management system,00000010101010000101111100001001010110010001
mental models navigation strategies,11000100011110011101011100100011010111101100
interfaces system comply standard,01001011000101100100010011111101110111010010
ability create add new,00000000001001011101100000010100111011001100
owner superket back end,11010111111101101110100001110110001101101000
respond citizens little turnaround,11100001111001101101100100000111010010111100
table flags needed identify,10110010110011111010101101100000001010100111
data processing pipeline evla,00101100011111111100011111001100101101011000
backend physical processor reboot,00011100100111100010101111111000011101110010
anyone channel name communications,00001011001001100111011100100101100111100011
standard guidance ict accessibility,10111010010010100001100101010101100000001110
logical headings short phrases,01000000011010100110111010111001111110001110
peers using udp minimal,11010001011100110111001001010100011001101001
image see price product,01011100000101001001011111110111111111010010
popup member attempts issue,11110110110110001001110001101001001001111010
resends simultaneous transfer data,11100011110101010110111001001001100101100011
product ingredients user actor,11111010010010110110111001111001000000111111
frequency domain processing shall,01110111010011000101111111111000110101110100
results view criminalaccused cases,10100000000100110000010010111110100110000111
advanced search system must,00001100101101001110111011001000111001011000
expected entities output data,01111000000011011101111101010101000101100011
taking account human capabilities,10110011111000000110100101010100000010001100
scan identifier uc description,10100110010010101001011001011100000100010001
broadcaster happen immediately taking,00010110011010100010000101110001110110011111
case none extended use,00110000110110110010110111100010010011110101
standard guidance software accessibility,10111010010010100001101010100001100000001110
interfaces communication interfaces abstracted,01001011000001111000010100101100000000000110
department information technology template,00100110101010110111111011000110110110000100
access aspects system user,00000001101000110010011011001000110011110010
would authenticate authorize user,10001101110000111100110001111010110011110010
actions sorting list search,00000110010101110000010100001100010100111011
using json string plain,10011011100010011011001011110000111110011101
patterns around could give,11010011000000110011110010101010101110001000
including replica self fourier,01011111101111001111011010110000101110101111
data send shall send,00101100011101011001011010111010010101100101
evident made evident user,01101011001110000011100110101100110011110010
target purpose link directly,10110011010111010000110100001101000100000000
