y_text,y_emb
set monitor meeting change,10101111111110010100001100010010000110011011
data records memory buffer,00101100011111011011101100010001000010010111
course none condition customer,00101010011110110010110011101000000101101001
different types users every,00100000111100101110101001101011101101011010
broadcaster want able select,00010110011100010010100000000001110100100010
resolution check resolution policies,11100011000001100101101110001100011110110011
domain conflict resolution check,01100010111001110101011110001100000110010110
selected support priy purpose,10100100001101101111011111111110011101000011
navigation recommended products module,11001000110111011110001111101011111001110011
values metadata shall receive,10011001011110011001111010111010011101110100
tools used databases communications,10010011011100111101110010110000000111100011
properly assemble complete lag,11111001000000110010000011110100101000100100
standardized ui framework maintains,10111010011100101010010111010100011000011011
skimming text supported provision,10101001101101100000011011011110011111000000
backend system needs robust,00011100100101100100011101100000110100001000
property might located near,11111001011110011011100100000110011001000010
shall able handle lag,10101110100000000000110101000111001000100100
data existing datathis includes,00101100011011010000100010010000001011111111
cached data unavailable critical,00010011001001011000111001010110100101111110
different channels normal operation,00100000111001100111001101101111111011100110
containing newer technologies older,00111000011110110011011011000111111011111000
shall able apply normalizations,10101110100000000000110000100011011011011100
validation members using unique,10011011001110001001101001101110010011100001
content without interruptions page,00111000000100011110100100101010111010110101
data fidelity dynamic range,00101100011011110100100110011110111101001001
familiar terminology navigation links,01111011110101100001111100100011001000011001
links w css bootstrap,01000011001100010011110010111101100010111111
complaint initiated police initiates,00111101010010110010001111011000101011001001
except purpose link clear,01101001111111010000110100001101000110110111
viewer security broadcasters assume,10011000000101001001000001011000100011011111
product name search box,11111010010110010010111010011101100010110101
process piped input including,11111110110111100110000101100111101011111101
processing shall able perform,11111110001101011101000000000001111010000111
make coding android studio,11000011110001101010000000101111010110100110
display title metadata display,01100001100100100011101100110011101100001100
proper accountability includes allowing,11111011000000000111100101111111100001110110
role system included use,10100011001101100100010101111111010011110101
navigation effort number navigation,11001000110011001001101101101001111001000110
groups input output information,01010000001010110011111101010101001011011111
conditions monitor compute errors,00111010001110010100000011111010001101010010
shall handled gracefully minimize,10101110100010100010100111000010111001111000
stream viewers rebroadcast stream,10111100101100010000001110111011010111100101
eases approach interaction information,01100111110000010000100100100010101011011111
kill backend process alter,01001100000000111001001111111011000001110000
difficulties perceiving certain colors,00100000011110100001000011000100100110101110
yet proposed fourier transform,10001100101111110011100111010111110010010000
includes allowing member see,01011111111000011101101100010011110100100101
want able view channels,10001001010000000000111001100000100110011100
want streams interrupted little,10001001010101111001100100101110001000001110
able see modify delete,00000000011101001001011100111001000100111001
case right access system,00110000110101000010110000000110110110010001
meeting accommodate change users,11000100100000000010110011001101110011010111
monitor processes shall periodically,11001010000111111100111010111010011110000000
module access mobile w,11001110011000000011011100111110110001001111
organised case user chronological,11010100111001100001101001111001000110110001
view response hisher admin,10011000001111000011000101001000100000100001
knowledge computers internet browsing,01000100011001111101110100101110100010010010
system srs correlator ee,10110010001101110111000010101111101100101010
filter units traffic proximity,01111110010100111001111001001010111101000000
specific users tasks information,10111001100100110101111011001100101011011111
new data existing datathis,11011001100001011000110110100001000100100000
internal parameter tables synchronize,01001011011110101100011011001011110110010000
meeting datelocation proposed meeting,11000100100001001000111111100111011000100100
assigned alerts pending tasks,00011011001000011111101101000111010110011001
based landing pages help,00010100000010001011001101011011101010011010
providing information interest users,11111000001010110111110100100101010011010111
satisfaction system stands user,10100010000101100100011011111000010011110010
transform frequency domain process,10010010000011101110100110001011111111110110
used databases communications interfaces,10011110111001011000000011110001101001011000
type book looking title,10010111110000101110011100000011010010001110
optionally selectable levels printed,11010100001101001000110100001001111111101001
colours fonts font sizes,00110101101011111001100111110011110101001111
include ingredients manufacture halal,01011111010010110110111100011001101010001100
set exclusion set preferred,10101111111011010001001010111111111111100001
shall store input data,10101110100101111011100101100111100101100011
coordinates etc error report,00101001010011010101000110101001111100110111
images video provided alternative,01011100001100110000111111100001000001010001
product want find search,11111010010100010010100111111010010100111011
done via username associated,01100010110100110000101001101001000011011110
system send verify shall,10110010001101011001011001100010010101110100
chief performance system within,00110010011110100001101011001000110001111101
ready transmission ee system,11101010010100101100010110010101010110010001
ethically morally broadcasters shall,01101011100110010101010001011000110101110100
meetings system shall take,11000100101101100100011010111010010110011100
search required book entering,10100111011111000101100001011100101101110100
manipulating application data performing,11000010011000010001000010110001111010000011
input output information elements,01011001111110101010100101101111101100100000
channel page peer notified,00110011101110101101011101000100111011010110
configuration information act sections,00111010010010110111110000011000010100101110
communications failures external correlator,00111100011011110110100111100111100101011111
broadcast service done ethically,00010110010101011110110110001011001101011100
connection another peer network,00111011111000010110101101000100111011000111
shall ability edit users,10101110100000000000010110010100010011010111
capacity number cases system,00010000111110110100110011000011110110010001
important features potential buyers,01011101001011110101011111010100100010011010
hisher admin analysis system,01010010001000001000010000101110110110010001
arising processing hardware req,00011001101111111100010101001100011100110000
consistent layout schemes supporting,00111001001010001110111010011010110110110100
make comparisons different units,11000011110001111001000010000011110011100111
access relevant information efficient,00000001101111001001000101101111101100100111
edit users system access,01100101000100110101111011001000100000001101
use case none extended,10011110101001100001101101100101101111000100
pages appropriate users want,11010110111000010000011001101011110001001010
interface user administrator operate,01001001000100111100100000110000011011100100
search functionality police personnel,10100111011011100100111111011000111110001100
mobile w access website,11001111101100010011110000000110110001010100
interfaces site secured via,01001011000101010010011010010110110011000010
meeting change preference set,11000100100001100110111111010000010101111111
output data management shall,11010101010001011000111100001001010101110100
process alter priority shall,11111110110000011100001111111101010101110100
suitable means including use,10110101001110001010000101111110110011110101
controls variety input devices,00101000100100110011100101100111100100001100
new browser windows popup,11011001100000100100111000111010111110110110
meta auxiliary data form,11001100110000111110010010110001101111100000
product recommended assumption none,11111010010111011110000001101110011011001011
buffer overflow conditions processing,00010010111110101010000011101000111111110001
peers rebroadcasting reusability webrtc,11010001011111011101111010000110010001011100
user interfaces use diverse,10011110010010010110001001111010101100011110
data unavailable critical data,00101100011100101011010010111111000101100011
state reason error occurred,10111110110111011100010110101001111011110111
point view mockup view,11110010000100110000011100111110010011000001
verification search facility based,10011001100101001110110111100100000010100000
plan better execute greater,11110010100000101011100110100010101110000001
opened supports users task,11011101110101101101011001101011110110011011
spam data certain extent,10111000110001011000110011000100101111001101
another peer begin streaming,00001011010110100010010001010010010111100111
graphical user interface must,01110000011100111100100100100100011001011000
general processes shall violate,01110011100111111100111010111010010001000011
implies system must include,01011101011101100100011100101100001011111010
office hours private activities,11011111110010101101001111111111100000111100
want able select multiple,10001001010000000000111010010001011001011011
information consistently page titles,01011011111001110010111101011010110010001010
main features proposed system,11000001010011110101011111100111010110010001
available provides ability librarian,00011101000111110000110000000000101000010010
diagram product ingredients module,00100000100111110100100101101101111001110011
convolution time domain processing,00101001110100100011010110001011111111110001
searches communication actions opening,10100111001001111000010000011001011011101111
platform cloud essentially receives,11110010110001101110100110101011111101111101
shall receive via mc,10101110100111011101001001100001011000111011
following investigation police shall,01111100101010011100001111011000110101110100
detailed contextsensitive help material,00100011010001010000100101001101011000111100
frequently accessed pages pages,01110111110000000011111101011011111010110111
rule anything captures implements,10100011101000010110000001000000101011101110
defects enhancement requests application,00100101111011011110101110001001100001000100
users within application also,10011010111100011111010000100010000001110001
whether web browser supported,10001110001100010111110001001001110110111100
another channel view whenever,00001011010001100111011001100000110001010001
mechanism place unauthorized users,11000101011111100110111001010111110011010111
important frequently accessed pages,01011101001011101111100000000111111010110111
physical processor reboot network,11110001010111111100001110111001011011000111
warning number translatable text,10001001000110110100111001011000010110000001
navigation differently varying user,11001000110001000001101001100110110011110010
shall replace invalid data,10101110100111001110110100101000100101100011
situations taken care ensure,10101001010101100111010011000000001101111111
actions taken either user,00000110010101100111010110010001110011110010
participant shall added participants,11010010010101011101000000010101111010010110
connections mobile channel concept,00111011110110011111010011001110100111110011
channel view whenever want,00110011101100110000011000101000110001001010
shall provide error warning,10101110100111110001100110101001110001001000
designed high level approach,00100010101010100101100100001000100001000010
possible restore system inline,11110111111111000000101011001000101011001110
select another channel view,10100100010000010110100011001110110011000001
halal non halal information,01010001100110110010100101000110001011011111
friendly users database user,01110110100100110101110010110000110011110010
entities cases suspects simultaneously,01101110111001100001111011011001110101011001
needs accommodated lower priority,11011000001000000010011100000110111111111010
implements database part firebase,01011101110001011000011101001000101111111010
internals system able rectify,01001011110101100100010000000001111101100100
simple search within seconds,10101011111101001110111000111110110100101011
events without human intervention,01101011110100011110100101010100001001010111
signaling functions arate availability,10101011100011100101110001100000100011111000
goals inferred behaviour observed,01110001111010110111000001010110111011110001
online mode support module,11011101001110011101001011011110111001110011
navigation option skip offered,11001000110110111000001010100110011011111100
priority meeting changed cancelled,11111111010110001001000011001101000010001111
get product ingredients alternate,01110011001111110100100101101101100001010000
layout schemes apply pages,01000111011101001101010000100011011010110111
navigation structures different user,11001000110101101000010010000011110011110010
recommending information potentially relevant,11101101000010110111111111010101111100100100
impose check prevent duplicate,01011101000001100101101111110110001100110101
active sessions shall automatically,00000110100101011111101010111010000011111010
structure labelled terms familiar,10110100000010001001111011000011001111011110
modify anything except personal,11001110010000010110000110100111111110000101
data complete requested operations,00101100011001111010011110001000111011100011
categories books available provides,00110001101000101110100001110100011111000011
system srs new operational,10110010001101110111001101100110011011100010
able initiate reboot internal,00000000011010110110001110111001001001011011
abstracted users browser operating,00000000110100110101110001001001111011100111
trail capable automatically capturing,10010010111000100001010001111101000010000000
time series spectra including,10010001101101011010011011100100101011111101
error report error number,01101010011111001101110110101001111011010011
recoverable output data construct,11101101101110101010100010110001100111000100
perceiving certain colors color,11010000100001100010010011010111000110101010
user hit set button,10011110010010100100001010111111100010011111
expected database would perform,01111000000001011000011000110111011010000111
interaction information exchange police,01001000101010110111110110100110111110110001
information captchabased authentication registration,01011011111000100000100001111001011100100011
status queue track record,10111111110111010011111001001110011101101011
directly search name product,00100000000101001110111100100101111111010010
layout according screen size,01000111011000000110011010011110010101001110
indicated label avoiding generic,01011110000010001001100001110111001110011010
rules small number sets,10100011100101010001011101101001110101111101
none extended use case,11011001011011110001001001111010100110000110
private professional meetings characterized,11111111111111110101011100010010100110010101
check backend physical processors,00110010110000111001001111000101011111010000
product module access mobile,11111010010110011100110000000110111001111101
protected privacy using whatever,11111001100111111111101001101110010001010010
return proper accountability includes,10100000101111110110000000001111001011111111
submitted defects enhancement requests,10110100100001001011110110111101011100010011
error number translatable text,01101010011110110100111001011000010110000001
windowing applied convolution time,10001110111000010001110010100111010010001101
periodically upon request check,11110000000100111111101110001000000110010110
data users webcam andor,00101100011100110101111000101110100001011111
connection prevent session hijacking,00111011111111111011001010111101001010010011
periodically upon request check,11110000000100111111101110001000000110010110
able stream whats screen,00000000011101111001011000101001110100111100
designing multimedia information presentations,00100010100110010111100101101111111111100111
module cctns acts conduit,11001110011001100010110000011111000111010011
access correspondences files records,00000001101001010111010111111000011101101110
evla observational mode needed,01101011000110111100001100111010011011000000
android version minimum latest,00001011110100110001011100111101001000111001
privacy using whatever constraints,11111111110100110111001000101001000111001100
messages language user interface,11001100010010001011111001111001001001001000
able provide reports actions,00000000011111110001101110011001100000110010
system must track events,10110010001110010110001001001110001101011110
appropriately acted upon users,00001000000000001100011001111111010011010111
peer connection navigation different,11010001001001110111111100100011000100000111
interface makes easy user,01001001000110000111110110011100110011110010
send information alternate course,10101100101010110111110000101000000101010011
temperatures date time phone,10110001100001001000011001000110111110001111
users view list vacant,10011010111100110000010100001100010011011010
replica self repeatable chain,11100111101101011000011110011100100110011000
speed sufficient accomplish processing,10111011000101101010110000001100011111110001
iso iso taken account,01001111111010011111111011001110100000011010
users privileges within systemg,10011010111111111111011000111110110110010011
strin application server ldap,10111100011000010001001010110100001000111010
get information acknowledgements police,01110011001010110111110000001000111110110001
avoided unless provide useful,00011101010100111011011111100011010011110110
packets correlator backend network,11010110100001010111110001110010011011000111
record actions taken either,11101101011000001100101011001110101100100011
user also use system,10011110010000011100011001111010110110010001
overflow conditions occur data,11010101000001110100011101111011000101100011
missing stopped defunct damaged,11001111110101111010110010010100100101100111
tested working multiple users,10110000010100011010011100101101110011010111
users means customizing user,10011010111110001010000010110110010011110010
long take commute work,11000000001101100111000011110001010001101000
connection internet successful use,00111011111010010111011011010111110011110101
output formatting shall combine,11010101010011101000101010111010000110100111
awareness planning process support,00011101101111100101111111111011010110111101
possible instance peers could,11110111111010110001111101000101100101010101
security broadcasters assume video,10100100100000101100010001101111110011000011
personallyidentifiable information captchabased authentication,11110000100010110111110001000001000011110010
planning meeting cancel meeting,11110010111110001001000001000111011000100100
taking account expected display,10110011111000000110100111100000001100001100
constructed chainable output fourier,00111000101001100110011101010101001110101111
able apply user selected,00000000011000010001101001111001010100100001
performs quick advanced search,11010000001111010011100000110010110100111011
viewers rebroadcast stream viewers,10001000000111011101101011110010110001000000
must embedded source code,11001011000011011000101011100001100110111001
text recognize identifier uc,10110000001111011110110101010010110010111000
buffer locations input data,00010010111010000001010101100111100101100011
assumption none frequency medium,00011011100110110010110111011101011000101101
monitor overall data processing,11001010000110101010010010110001111111110001
mode shall receive via,11001110100101011101001110111010010011000010
technical contexts use eg,10110001011001010000111001111010101100100010
expressed participant shall added,01111000101110100100101010111010000000101011
recommendations described iso iso,11101111001001001100000100111111101001111111
piped input including replica,11110011000010110011110101111110111100111101
appropriate homepages navigation pages,00001000001010101100111100100011011010110111
message warning source warning,11001100001100010010001011100001110001001000
ordered contains valid data,11010100110001110000011001101101100101100011
dropdown button opposed horizontal,01100110001000100111111101110000101010110111
allow rapid retrieval frequentlyused,00001110101111010010001010000001001110111101
output data streams memory,11010101010001011000111011110011011000100010
block access system users,00010101001000000011011011001000110011010111
data castes tribes property,00101100011001100001011001011001011111001011
status report internal system,10111111110111001101110100101101110110010001
feature allow users see,01111010100000011101011001101011110100100101
showsup single processor backend,10101010010101010110001111111000000011100100
data ee system send,00101100011011001010101011001000110101100101
clearly distinguishable links lead,00110110101011000010000100001100101000111110
need reschedule meeting proposed,11001000000111000111001100010010011111001110
conditions monitor processes shall,00111010001110010100001111111001110101110100
requirement third option ie,11100010111100100001111101110000001010100001
privileges password allocation management,11111111101110100111100000111010011000010010
interfaces robust user interfaces,01001011000101000010001001111001001001011000
reliable communicate request replies,11100101101001101000001110001000011100110100
tool useful allowing price,10010011001100111101100000111011011111101111
frames used care taken,01110101011100111101110011000000010110011101
information cases assigned alerts,01011011111001100001110001101100100001111110
computation error statistics compare,00111111101011010100111011111111100111100110
attributes adaptability peers attempt,00011010000000001110111101000101100011010111
interrupted little possible peer,01001011100010000011101111011111111010001001
performance shall monitor data,11010000110101011101001100101000000101100011
least peers using recent,01000111100110100010111001101110011101111111
domain process piped input,01100010111111111101101111001100001011001111
new connection another peer,11011001100001110111110000101101011010001001
processes shall violate archive,11111110011101011101001000100001100011000110
sets provide familiar common,10101111101111110001100111101111000110100011
opening times download times,11011101111100100011110110001001010010001111
structure system implemented integration,10110100000101100100010101110111101001000000
particularly links representing main,11010010101010000110011110011000111000001010
user clear sufficient indication,10011110010001101101111011010101101011010001
user selected frequency domain,10011110010101001000010111011101001100010111
user limit access cases,10011110010010000111010000000110100110000111
fourier transform lag set,01110101111100100100000100010010010101111111
function failure attributed component,01110110000011110110110001101000100111111010
distances certain high priority,01100001011001100010010101001011011111111010
operating conditions warrant debugtest,11011100111001110100011000101100000100100101
ingredients manufacture halal certificate,01011011011110001100110101000110000110001000
navigation structure current segment,11001000110101101000000010111100010100100111
view channels without constraining,10011000001001100111001000111101000111001111
home page application landk,01010110000110101101010000100010001000101101
time update delete hisher,10010001101100111110000010011100101010010001
links clearly distinguishable links,01000011001001101101010110000100001000011001
pillai institute information technology,11110001000010110000100101101111110110001101
condition actor able access,00111010000000001111110000000001100000001101
passwords system administrator shall,11010011010101100100010000110000010101110100
user view quick reports,10011110010100110000011110100111011100110011
links controls navigation links,01000011001001010001001100100011001000011001
processing tasks avoiding loss,11111110001101100110010001110111011000000111
user adaptation adapting content,10011110010000001110000000010100000111000000
going develop used chief,01110001101001000011101001111011100110010011
attributes correctness product implement,00011010000001010110101111101001001011100100
number translatable text error,11011010011100101100001011000000101101010011
fourier transform showsup single,01110101111100100100001010101001010101011000
want read content without,10001001010111010111000011100000010001111010
peers adopting method requires,11010001011000011001111100110010111100010100
application program interface database,00001000100111110111010100100100000101100001
media studies research department,11000101110101101000101110001111100100110101
police citizens eases approach,11110110001001101101100110011111000001000010
intervention store audit trail,01001010111101111011100001111000010010010111
without interruptions page needs,10001111010010010101011101011010111011000001
channel name communications peers,00110011101110010010110011110001111010001011
able access module based,00000000011000000011011100111001100010100000
send verify shall verify,10101100101100110001001010111010010011000100
client server communication channel,00110111100101011010000011110000100110011101
existence case title metadata,01101000110001100001101001000111011001100111
