y_text,y_emb
authority grant revoke privileges,00011110111011100001101010000111011111111101
understand navigation structure negative,10010100110110010001101011010000011011000011
rate tbd access speeds,11101011000101100110000000000110110111011001
testing maintenance personnel hand,10110000011110000110101111000110001010001111
menus iso command dialogues,11001100000010011111110011010001000100000101
user interface must suitable,10011110010010010010001100101100010110101001
authorize user access system,00011110101100111100100000000110110110010001
date actual meeting extensibility,00100100001000001110101100010010001111001100
cases without affecting audit,00110000111100011110100000110111100011110000
books users without fault,00010111010100110101111000111101001111011100
correlator rate manageable ee,00101011111111010110001100001011101100101010
processing pipeline applications processing,11111110001111100110010000100010111111110001
security level privileges password,10100100100010000100011111111110111010011110
connection navigation different channels,00111011111110010001100010000011100110011100
method requires third party,11001100101111000101001001000011111010011101
information alternate course none,01011011111000010100000010101001111011001011
navigation shows interface users,11001000110101010100110100100100010011010111
shall notify mc detected,10101110100110110100101100011101100100011000
processor network functional state,11111110000110110001110111001000010111110110
times commonly performed functions,10010001111001101000011101000001001110010111
captchabased authentication registration used,00010000010000111100101110010001110011110111
members using unique member,11000100110100110111001001110000111000100111
must sufficient educate users,11001011000101101010110110010101110011010111
module cctns provides role,11001110011001100010111111100001110100011001
backup disk storage processed,00011100111011000001011011110101011111110010
display characteristics spatial arrangement,01100001100001100101001011100011100011001110
support api application program,10110111101000010010010000100010011111011101
help navigating cctns application,01010011010110010001110011000101100001000100
general knowledge prior experience,01110011100010001000111111111100101111000001
processor speed sufficient accomplish,11111110000101110110001011010101100000011000
minimize spam verify human,11001111000101110001101001100010001010101000
tracker identifier uc description,10010010100010101001011001011100000100010001
idea behind feature would,01010101110000101011110111101010010001101110
mainly bottlenecked browser implementations,11000001011000101111000001001001101011101101
rules business rule anything,10100011100000100111011010001110100001011000
case suspect property system,00110000110101101100101111100101110110010001
fixed determination meeting date,01111101000001000010111100010010000100100001
end user administrator functions,01101101000100111100100000110000001110010111
use hardware interfaces software,10011110101010100110000100101100010101000011
tcpip protocol http https,10110001001111110001010101011100101010111000
applicable grant user access,00001001100011100001101001111001000000001101
time domain processes frequency,10010001101011000101111111111001101110111010
processors processes networks failure,11111010000111111100111101100010101111011011
including housingu logo important,01011111101010101111110100000000001011101001
perform fourier transform lag,11010000111011101011111001001000001000100100
time stamp warning report,10010001101101110101101000100100011100110111
compiles code hosts isolated,00111101111001101110010101011010101001111110
network media information application,11011000111110001011100101101111100001000100
create update viewing details,00101110110100111110001000100000100100011001
role based landing pages,10100011001000101000000100010110011010110111
modules messagedata involved listed,11001110001110011000110100111001001000001000
password data migration ie,11010011110001011000111100110101001010100001
gracefully minimize stream disruptions,01110000101110011110001011110010101100001110
watch peoples live streams,10001011001110100011010100000111110111100110
destination ip addresses correlator,00100011110010011101010000010010100101011111
good graphical interface user,01110001100011100000110100100100010011110010
changing network conditions lowbandwidth,00110011111110110001110011101000111000001100
application domain experience using,00001000100011000101110111100000110011011100
described iso iso taken,00100110000010011111110100111111110110011101
compatible aips measurement sets,00111101101000011110011100010100110101111101
system shall acknowledge receipt,10110010001101011101000000001001111101110101
used support modules messagedata,10011110111101101111011100111000111001100011
must provide adequate response,11001011000111110001100000010011111100001100
rates applicable time stamp,11101011001000010011001001000110110111010110
formatted output data records,01110100011110101010100010110001111101101110
users tasks information needs,10011010111101100110010101101111111011000001
helpdesk user view reports,01010011110100111100101001100000111100110011
flags processes applied coordinates,01111101010111111100110000100011100101001010
undue interruption peers rebroadcasting,10010100000010010101001101000101111101110111
system must exceed per,10110010001110010110000110100111011010001100
allow user member one,00001110101100111100101100010011111011101000
designed robust possible face,00100010101101000010001111011111101111001010
navigation product recommended identifier,11001000110111110100101110111100001010100101
like providing users means,01000010100111110000011001101011111000101000
document provided prints content,01100011101111110000101111111100000111000000
authentication provided one able,00011110010111110000101101110100000000000011
admissibility assist data recovery,00001100110000110110100010110001111101101100
interface personal needs ie,01001001000111100001011101100000101010100001
data filter parameters frequency,00101100011011111100101101011000001110111010
side automatic connection broadcaster,10101010101000111111100011101111100010110011
without manual intervention store,10001111010110001100010100101011110111101110
shall customizable two ways,10101110100001011011111001011111110001011010
also appear product users,00001110001000010010101111101001010011010111
delay input output data,00100111000010110011111101010101000101100011
passwords metro management protected,11010011010110011011001100001001011111001100
configuration configuration module cctns,00111010010001110100101100111001100110001011
must minimum able provide,11001011000110011110100000000001111111000110
update viewing details book,10011111000100010000010010001100100010111001
proposed integration shall able,11111001110010010000001010111010000000000011
processor shall able initiate,11111110000101011101000000000001101011011000
experience application domain experience,01111000001000010001000110001011101111000001
shall take account constraints,10101110100101100111000000001101000111001100
comparisons many different houses,00111100100110001100100010000011101010111101
javascript framework tools ui,01001101010011101010001001001101110010101001
userdefinable values values previous,10011110000100110010111001100101111111101101
achieving selfdescriptiveness given iso,00000010010101011000100111000100101001111111
product must adaptable sense,11111010010110010110000000011100110101101100
able handle rebroadcasting least,00000000011010100011101110111011101000111100
cctns acts conduit information,00110001011000001111100011101001101011011111
take fully take advantage,10110011100011101100011011001110000001100100
entry status queue track,01101110011101111111101110100111110010011100
nonprivileged participant aware constraints,11011011010110100100100001110111100111001100
planning process support negotiation,11110010111111111101101011011110111011000010
meeting initiator monitor meeting,11000100100010110010101100101000011000100100
common look feel application,00110100011110000000100111101011000001000100
documents data also need,01100010100001011000110000111000111001000000
amount tbd memory sufficient,00001010101101100110001100010001010110101011
see amount interest unit,10100100101000010101010100100101010011100010
presented order increasing security,11111100101110101000100101111011010100100100
non halal information halal,11011001010010100011000101101111101010001100
system easy learn understand,10110010001011001110010100011110110010100110
shall able perform withou,10101110100000000000111101000011110001111110
software hardware failure must,10101000011010100110000111101101111001011000
halal searching module halal,01010001100101001010001100111001101010001100
fourier transform retention output,01110101111100100100001010000001111010101010
selected frequency domain processes,10100100001011101110100110001011111111110011
changes external inputs affect,00110011110011110011110101100110100001101101
simultaneously output stream necessarily,10101011001110101010101011110010111001000011
essys app fireb ase,01101010101000010010110111111111000011001010
series spectra including invalid,10101101001101110010010101111110101001010001
new user system administrator,11011001100100111100101011001000100001100000
sections state specific data,10100101110101111101101011100110000101100011
must suitable users special,11001011000101101010011001101011110111000101
processors assure needed processors,11111010000000110101001101100000011111010000
colour means conveying information,00110101111110001010000010100111101011011111
within certain distance santa,10001111101001100010010110000101010100010001
human perception designing application,01010101000110100001010010001010000001000100
fourier transform processing shall,01110101111100100100001111111000110101110100
software unusual requirements allowing,10101000011100111010011110001010100001110110
process introduces operational efficiencies,11111110110010010100101101110001001100100100
shall trap flag repair,10101110100100101100110111110100111100111000
work even friends house,10001101000011010111010111011010101010111100
accounts admin members member,00000011111000001000011100010011011000100111
users special needs compatible,10011010111101110001011101100000100111101101
able stream lot people,00000000011101111001011100000010011010001111
potentially relevant interesting specific,11110101011111001001000100100100110111001100
search results level security,10100111011101000000000100001000110100100100
schemes supporting user finding,10100110101101101101001001111001001111111100
database admin rights update,00101100001000001000011010000100110011111000
needs expectations system different,11011000001011010000001011001000100100000111
among using standard tcpip,00001010111100110111001011101001010110001001
items shrinking navigation menu,01001101000101010101101100100011011000100000
errors determining expected data,01101010010001000010100111100000000101100011
assemble complete lag sets,00011001000001111010010100010010010101111101
module cctns gives police,11001110011001100010110111000101111110110001
users offline online mode,10011010111110111110111101110100111001110100
able select channel see,00000000011101001000100011001110110100100101
sheets andor frames turned,10101110111000010111110111010101110010111101
none extended use case,11011001011011110001001001111010100110000110
gives police personnel ability,01110001011111101100011111000110000000000001
uc description search product,10010111000001000100011010011101111111010010
done dynamically much flexibility,01100010110011001111111100101111101111101110
profiles evident predefined user,11111011100011010110011111010011110011110010
option using mobile device,11011100000100110111001100111110100100001101
user track submitted defect,10011110010100100111001011010010000100101101
input data continuous time,01011001111001011000110010100011010010001101
matter screen size using,11000111101101001111001010100111010011011100
drudgery large amounts paperwork,01100110011010001010110000101010011010110011
condition customer get product,00111010000001011010010111001100111111010010
information needs providing different,01011011111110110000011111100000100100000111
product changes owner superket,11111010010001100111101101011111110110111010
version use mobile application,10011000101100111101011100111110100001000100
varying numbers cases handled,10011001101110110100010011000011101010001010
priy purpose use page,11111111100111010000111001111010111010110101
report tolerance conditions monitor,11100110111100100010000011101000111001010000
approach without worrying lower,00001000010100011110101000110101011000001101
applicable post condition customer,00001001100111101110100011101000000101101001
broadcaster either internal external,00010110011011001000110100101101101111001111
pages style sheets andor,11010110111101101001111010111011100001011111
use secured database normal,10011110101101001011010010110000111011011111
new windows distract confuse,11011001100100011101010110001100100111010100
tasks etc hence helping,10110011001011010101000101001110001010011111
customer package uc budget,00101101001110101111001001011100000010010110
communication reliable communicate request,00111100001111001011010011010000011100010000
shall verify successful delivery,10101110100100110001001011010111100100111111
capturing storing information actions,00010000000101111011010101101111100000110010
stored due previous ee,10111101111011001101111111110110101100101010
time series lag sets,10010001101101011010010100010010010101111101
layout scheme category consistently,01000111011101001101110011000111100111001011
shrinking navigation menu dropdown,10101010110110010001101100010000001100110001
text shorter chunks presentation,10110000001101011100010011011001111111100110
printerfriendly version document provided,11111101000100110001010110001110111111000010
none including use case,11011001011010111111011001111010100110000110
using whatever constraints required,10011011100100010100100011100110011100010110
confuse impede users variety,00111010100010111001111001101011110011001110
processes frequency domain processing,11111110011011101110100110001011111111110001
http secure json scheme,01010111001101001011110100110110010100110111
interest users making access,01001001010100110101111100001110100000001101
uc text recognize assumption,10010111000101100000011110111101100011011100
access cases must log,00000001101001100001111100101100001000000111
never include search result,11011000100010111110101010011101111100000000
page titles placed consistent,11010110101100100010101111001101000111001001
want find search box,10001001010011111101001010011101100010110101
requirements use case view,11100010101100111101010011000011010011000001
requirements login ids passwords,11100010101010000000010101010001111010011010
individual users user groups,01011010011100110101111001111001001010000001
login asks user type,01000000001000110010111001111001010010111110
track data invalids normalization,10010011100001011000110100101000011011011101
interface designed simplicity functionality,01001001000001000101011010101111001110010011
users tasks information needs,10011010111101100110010101101111111011000001
system knowledge internals system,10110010001010001000110100101111010110010001
modify delete profile demand,11001110010001001110011111101010000100111101
json strin application server,01001101100101111000110000100010010101101000
security issues order prevent,10100100100010011110011101010001011111101100
tolerances report tolerance conditions,10010011000111001101111001000100000111010001
external personnel little familiarity,01111001111111100011000100000111001111011111
app w access web,00001001011100010011110000000110110001011111
names positions sequence adjustable,11001001110111101111001010110101000000100110
user profiles userspecified profiles,10011110010111110111001001101010111111011100
provides role based landing,11111000011101000110010001010000001000101100
based evidence facts following,00010100000011010110110111101100001111100101
requests user well calls,11100010011100111100101000101011100010001000
mode correlator output parameters,11001110100001010111111101010101011010110000
monitor io performance shall,11001010000010011101111101000011010101110100
allowing core signaling functions,00001110110001010010011010101110001110010111
iso direct manipulation iso,01001111111001000000011100001000101001111111
compute performance shall monitor,00111110100110100001101010111010011001010000
possible actions user take,11110111111000001100101001111001010110011100
conditions occur data send,00111010001110111101100010110001110101100101
sense displays properly functionally,10101101100011000011111111100100001110010010
data cannot modified way,00101100011000100011011100111011010001011011
serial barcode deduct amount,10101101011000111000000010010010000001010101
lessen impact minimum following,01000010000010111000101100111101001111100101
product run heroku platform,11111010010101000101000101001010011110010110
persistent defaults data entry,11110000110001001011000010110001101101110011
receive data users webcam,11101110100001011000111001101011110001011101
different input devices activating,00100000111010110011110010000110000000110111
meeting application domain conflict,11000100100000010001000110001011100111010101
nonhalal goal give halal,11011011011011100011100111000100001010001100
channels normal operation cause,00110011100110110111111101110011000110001010
lists highlighted keywords logical,01000001010010100100100100110000101000000011
simultaneously output stream necessarily,10101011001110101010101011110010111001000011
combine finished spectra meta,00110100111011111111111011100100111001100110
allow cases cases used,00001110101001100001110011000011110011110111
able perform fourier transform,00000000011110100001110111010111110010010000
several optionally selectable levels,10101111100110101000011010010001101000010011
want able disconnect channel,10001001010000000000110110000001000110011101
service perlldap module cpan,10101111011111100000111100111001100101110000
html css bootstrap react,01010111011001011110110001011111111101011101
application user friendly proper,00001000100100111100100111011010011111011000
focused providing value police,01111101101111110000011001100100111110110001
view broadcast content user,10011000001000101100100011100000010011110010
password change contain randomized,11010011110001100110110011100001011101001011
owner add remove update,11010111111000001010011110010101110011111000
large police stations varying,01000101011111101100011011111110110011001101
error warning reports mc,01101010011100010010001110011001111000111011
disconnections trigger new connection,01100000110100101101101101100110000111011111
compatible specialist software used,00111101101101110001001010100001110011110111
priy window hiding relevant,11111111100100011101100101001011111100100100
access mobile app w,00000001101110011111010000100101110001001111
include standard header including,01011111010101110100100101001100101011111101
store audit trail information,10111101110000111100001001001011101011011111
bandwidth using industrystandard compression,00011100010100110111000101101010100111111111
stream private anyone channel,10111100101111111111110000101100100110011101
quantizer power measurement data,11101000100111101010101100010100100101100011
incidents unplanned downtime system,01011111011100111011100110001000110110010001
labelled terms familiar user,01000100111101100001100111101111010011110010
debugtest messages shall provide,00100100101110011000101010111010011111000110
providing links information page,11111000001010000110010101101111111010110101
attempted attempted violations access,00011010110000110101101000100001000000001101
readable taking account expected,11101010101101100111110000001101001111000000
links open new browser,01000011001110111010101101100110000010010011
quality quality textual content,11101000111111010001111001000000100111000000
either long dispersed several,01100100011110000000010110000010010101111100
means customizing user interface,11000101000001011011001001111001001001001000
entered addresses google verify,01101111100000001001010111000010010011000100
product nameprize state halal,11111010010110010010101011111011001010001100
older user agents well,11011111000100111100100000110100110001010111
level privileges password allocation,01000010001111111111011101001111000001110100
aware constraints stated participants,00011101111001110011001011111011111010010110
presenting information user found,11111100100010110111111001111001001110101101
disk crashes power failures,01100000101001011100101111010101001111011010
integration mobile phone application,01001000000110011111011111000111100001000100
ppcast page mockup homepage,11110101111110101101011100111110001010110001
platform record entries court,11110010110111011010110110111001000101010001
studies research department information,10110100010111000111110010011010101011011111
tables synchronize data processing,10110010111101100100000010110001111111110001
clientside serverside portability reliability,00110111111101011110011111011011111100101100
source warning rates applicable,10111000011100010010001110101100100001001100
able create channel stream,00000000011001011101100011001110110111100101
database communications interfaces site,00101100001001111000110100101100010101001001
features section describes main,01111010101101001010100010001000011000001010
data shall guarantee safe,00101100011101011101000101000001110100010111
location shall changed meeting,01000000100101011101000011001101011000100100
institute information technology engineering,01011000010010110111111011000110101101111011
flags needed identify various,01111101010110110000000101010011110011001111
product details location show,11111010010001000110010100000010010101110000
blocks information displayed becomes,00010111000010110111110110000110100010100111
show halal nonhalal product,10101110000010100011001101101101111111010010
application pages designed implemented,00001000100110101101110010001010101011101111
account expected display characteristics,00000011010011110000000110000110000110010100
able show traffic different,00000000011101011100001001001010100100000111
protocol sdp hides many,11111000101101001110100101001010111000110010
shows categories books available,10101010011001100011010001011101000011101000
evident predefined user profiles,01101011001111101001111001111001011111011100
behaviour observed recommending information,00010101101110111100011110110100001011011111
operational parameters critical locations,11011100010110101100000010111111001000000101
changes menu contents layout,00110011110110001000000010100000001000111011
store input data records,10111101110010110011110010110001111101101110
failures external correlator ee,01111011010011110011110010101111101100101010
prefer certain input mode,11110100010001100010010101100111111001110100
invalids normalization shall able,01001010000110110111011010111010000000000011
created login asks user,00101110111010000000010001100101110011110010
impair visual skimming page,01011100110100010001001010100110111010110101
based hisher general knowledge,00010100000010100100010111001110001000100011
technologies older user agents,10110001111110111110001001111001000001101001
access aspects system authority,00000001101000110010011011001000100011110111
first encounter unavailable critical,01111111001011011011101001010110100101111110
send output data ee,10101100101110101010100010110001101100101010
operations cached data unavailable,11011100011000100110010010110001110010101101
limit provided library policy,01000011101111110000100100001011111110110010
begin broadcasting hardware interfaces,00010100100000101100000101001100001001011000
ppcasts peertopeer network allowing,11110101101110100010101101100011100001110110
android studio software develop,00001011110101101001101010100001100100001110
connection software requirements specification,00111011111101010000111110001010110111001111
use function keys onscreen,10011110101011101100000100110001111011101011
would give value user,10001101110011100010001001100100110011110010
paths navigating specific unit,11010011001110010001111011100110010011100010
cases integral part responsibilities,00110000111010110000011101001000111100000101
data needed perform fourier,00101100011110110000001101000011101110101111
shall readily accessible maintenance,10101110100111010101110000000101011000011010
view page broadcasts point,10011000001110101101010001001000011110010000
frequency medium basic course,01110111010110001011010001010001100101010011
main navigation structure labelled,11000001010110010001101011010000001000100111
display case information indicate,01100001100001100001100101101111101011110001
conflict resolution check resolution,00111010101111000110000011001011011100011000
varying user groups roles,10011001101100111100100101000000110100011010
distance blocks information displayed,01100001010000101110000101101111101100001101
means including use short,11000101000010111111011001111010110101110011
human thus prevent spam,01010101000100100011001111110110010111000110
extended use case none,01111000100100111101010011000011011011001011
maintain input data fidelity,11000001001010110011110010110001101111010010
station constantly interfaces courts,10111111100001110011100100101100000101010000
pages different purposes types,11010110111001000001111110100001010010111010
connecting two peers directly,00111011101100101111111101000101100100000000
complete lag sets output,00111101001010001001001010111110111010101010
data invalid count shall,00101100011010010100010010101011110101110100
profiles userspecified profiles used,11111011100100110101011111101110010011110111
verify receive shall verify,10011000100111011101001010111010010011000100
